{
  "build_time": null,
  "counts_by_accuracy": {
    "approximate": 139,
    "exact": 42,
    "unknown": 49
  },
  "counts_by_band": {
    "lt_1_6km": 3,
    "lt_40km": 393,
    "lt_8km": 19,
    "touching": 62
  },
  "counts_by_utility": {
    "Dalton Utilities": 3,
    "Dominion Energy SC": 54,
    "Georgia ITS (joint)": 3,
    "Georgia Power": 91,
    "Georgia Transmission Corp.": 66,
    "MEAG Power": 13
  },
  "no_overlap_count": 97,
  "source_documents": [
    {
      "date": null,
      "doc": "SCRTP Planned Facilities 2026-2030 $2M & Above",
      "url": "https://www.scrtp.com/assets/pdfs/home/2026-2030-2million-and-above-project-descriptions.pdf"
    },
    {
      "date": "2025-11-26",
      "doc": "SERTP 2025 Regional Transmission Plan (Nov 26 2025)",
      "url": "https://www.southeasternrtp.com/docs/general/2025/2025%20Regional%20Transmission%20Plan%20and%20Input%20Assumptions.pdf"
    }
  ],
  "stage_counts": {
    "cross_state": 44,
    "dropped_outside_ga_sc_footprint": 69,
    "dropped_outside_selected_balancing_area": 101,
    "dropped_powersouth_excluded": 4,
    "dropped_unlocated_outside_selected_area": 77,
    "kept": 230,
    "overlaps": 477,
    "placed": 181,
    "placement_candidates": 380,
    "source_rows": 481,
    "unmapped": 49
  },
  "stale_brief_count": 0,
  "unmapped_count": 49,
  "unmapped_reasons": {
    "not_located_by_current_inputs": 49
  }
}
